{
  "id": "england-wales-london-rough-sleeping",
  "name": "London Rough Sleeping Content Pack",
  "description": "Comprehensive content pack for London rough sleeping and homelessness prevention, covering England/Wales legislation",
  "version": "1.0.0",
  "jurisdiction": "England/Wales",
  "language": "en",
  "supportedLanguages": ["en"],
  "effectiveDate": "2025-01-01",
  "entryPoint": "q1_homeless_tonight",
  "questions": [
    {
      "id": "q1_homeless_tonight",
      "text": "Are you homeless or will you be homeless tonight?",
      "description": "This helps us understand the urgency of your situation",
      "type": "yes_no",
      "category": "situation",
      "required": true,
      "stateMapping": "situation.homelessTonight",
      "transitions": [
        {
          "condition": {
            "operator": "equals",
            "value": true
          },
          "next": {
            "type": "question",
            "id": "q2_current_location"
          }
        }
      ],
      "priority": 100
    },
    {
      "id": "q2_current_location",
      "text": "Where are you right now?",
      "type": "text",
      "category": "situation",
      "required": true,
      "stateMapping": "situation.currentLocation",
      "transitions": [
        {
          "condition": {
            "operator": "any",
            "value": true
          },
          "next": {
            "type": "question",
            "id": "q3_has_pets"
          }
        }
      ]
    },
    {
      "id": "q3_has_pets",
      "text": "Do you have any pets with you?",
      "type": "yes_no",
      "category": "personal",
      "required": true,
      "stateMapping": "user.hasPets",
      "transitions": [
        {
          "condition": {
            "operator": "equals",
            "value": true
          },
          "next": {
            "type": "question",
            "id": "q5_has_children"
          }
        }
      ]
    },
    {
      "id": "q5_has_children",
      "text": "Do you have any children with you?",
      "type": "yes_no",
      "category": "family",
      "required": true,
      "stateMapping": "user.hasChildren",
      "transitions": [
        {
          "condition": {
            "operator": "any",
            "value": true
          },
          "next": {
            "type": "action",
            "id": "evaluate_section_188"
          }
        }
      ]
    }
  ],
  "rules": [
    {
      "id": "section_188_emergency_duty",
      "name": "Section 188 Emergency Accommodation Duty",
      "description": "Council duty to provide interim accommodation if applicant may be homeless, eligible, and in priority need",
      "jurisdiction": "England/Wales",
      "legalBasis": "Housing Act 1996 Section 188",
      "priority": 100,
      "conditions": {
        "type": "all",
        "rules": [
          {
            "field": "situation.homelessTonight",
            "operator": "equals",
            "value": true
          },
          {
            "field": "legal.rightToReside",
            "operator": "equals",
            "value": true
          }
        ],
        "nested": [
          {
            "type": "any",
            "rules": [
              {
                "field": "user.hasChildren",
                "operator": "equals",
                "value": true
              },
              {
                "field": "user.isPregnant",
                "operator": "equals",
                "value": true
              },
              {
                "field": "user.age",
                "operator": "lessThan",
                "value": 18
              },
              {
                "field": "situation.atRiskOfViolence",
                "operator": "equals",
                "value": true
              }
            ]
          }
        ]
      },
      "actions": [
        "emergency_accommodation_assessment",
        "contact_local_authority_emergency"
      ],
      "metadata": {
        "version": "1.0.0",
        "effectiveDate": "1996-01-01",
        "author": "U-HSP Legal Team",
        "tags": ["emergency", "section188", "priority-need", "interim-accommodation"]
      }
    },
    {
      "id": "pet_friendly_shelter_priority",
      "name": "Pet-Friendly Shelter Prioritization",
      "description": "When user has pets, prioritize pet-friendly services",
      "jurisdiction": "England/Wales",
      "priority": 50,
      "conditions": {
        "type": "all",
        "rules": [
          {
            "field": "user.hasPets",
            "operator": "equals",
            "value": true
          },
          {
            "field": "situation.homelessTonight",
            "operator": "equals",
            "value": true
          }
        ]
      },
      "actions": [
        "contact_pet_friendly_services",
        "pets_in_crisis_referral"
      ],
      "metadata": {
        "tags": ["pets", "shelter", "accommodation"]
      }
    },
    {
      "id": "rough_sleeping_outreach",
      "name": "Rough Sleeping Outreach",
      "description": "Trigger outreach team contact for rough sleepers",
      "jurisdiction": "England/Wales",
      "priority": 80,
      "conditions": {
        "type": "all",
        "rules": [
          {
            "field": "situation.roughSleeping",
            "operator": "equals",
            "value": true
          }
        ]
      },
      "actions": [
        "contact_streetlink_outreach",
        "outreach_team_referral"
      ],
      "metadata": {
        "tags": ["rough-sleeping", "outreach"]
      }
    }
  ],
  "actions": [
    {
      "id": "contact_streetlink_outreach",
      "name": "Contact StreetLink for Outreach Support",
      "description": "Alert StreetLink about rough sleeper to trigger outreach team visit",
      "type": "immediate",
      "category": "emergency",
      "urgency": "critical",
      "steps": [
        {
          "order": 1,
          "instruction": "Call StreetLink on 0300 500 0914 (available 24/7)"
        },
        {
          "order": 2,
          "instruction": "Or use the StreetLink website or app to report location",
          "requiresInput": false
        },
        {
          "order": 3,
          "instruction": "Provide exact location details (nearest landmark, street name)"
        },
        {
          "order": 4,
          "instruction": "Outreach team will aim to visit within 24 hours"
        }
      ],
      "contactInfo": {
        "phone": "0300 500 0914",
        "website": "https://www.streetlink.org.uk",
        "hoursOfOperation": "24/7"
      },
      "estimatedDuration": "5-10 minutes to report, outreach within 24 hours",
      "relatedServices": ["streetlink_london"],
      "metadata": {
        "tags": ["outreach", "rough-sleeping", "immediate"]
      }
    },
    {
      "id": "emergency_accommodation_assessment",
      "name": "Emergency Accommodation Assessment",
      "description": "Apply for emergency accommodation under Section 188 duty",
      "type": "application",
      "category": "housing",
      "urgency": "critical",
      "steps": [
        {
          "order": 1,
          "instruction": "Contact the local authority housing department immediately"
        },
        {
          "order": 2,
          "instruction": "Explain that you are homeless tonight and have priority need"
        },
        {
          "order": 3,
          "instruction": "Request emergency accommodation under Section 188",
          "requiresInput": true,
          "inputFields": [
            {
              "name": "localAuthority",
              "label": "Which local authority are you applying to?",
              "type": "text",
              "required": true
            }
          ]
        },
        {
          "order": 4,
          "instruction": "Provide proof of identity if available (but lack of ID should not prevent assessment)"
        },
        {
          "order": 5,
          "instruction": "Answer questions about your circumstances honestly"
        }
      ],
      "requiredInformation": [
        "Current location",
        "Reason for homelessness",
        "Any children or dependents",
        "Any vulnerabilities"
      ],
      "estimatedDuration": "2-4 hours for initial assessment",
      "documentation": {
        "guidance": "The council has a legal duty to provide interim accommodation while they assess your case if you appear to be homeless, eligible, and in priority need."
      },
      "outcomes": [
        {
          "id": "accommodation_provided",
          "description": "Emergency accommodation provided",
          "nextActions": ["full_homelessness_assessment"]
        },
        {
          "id": "accommodation_refused",
          "description": "Emergency accommodation refused",
          "nextActions": ["legal_advice_referral", "complaint_process"]
        }
      ],
      "metadata": {
        "tags": ["emergency", "section188", "assessment", "local-authority"]
      }
    },
    {
      "id": "contact_local_authority_emergency",
      "name": "Contact Local Authority Emergency Housing Team",
      "description": "Contact the appropriate London borough emergency housing team",
      "type": "immediate",
      "category": "housing",
      "urgency": "critical",
      "steps": [
        {
          "order": 1,
          "instruction": "Identify which London borough you are in or have connection to"
        },
        {
          "order": 2,
          "instruction": "Call the borough's emergency housing line (numbers provided for each borough)"
        },
        {
          "order": 3,
          "instruction": "If outside office hours, many boroughs have 24-hour emergency lines"
        }
      ],
      "estimatedDuration": "Immediate call, may need to attend office",
      "contactInfo": {
        "hoursOfOperation": "Varies by borough - many have 24-hour emergency lines"
      },
      "metadata": {
        "tags": ["local-authority", "emergency", "housing"]
      }
    },